пгт. Оленовка;ОСМД «Луч»;пгт. Оленовка, мкр. Новый, 2;Литвинова Зинаида Николаевна 071 307 62 70;165+15;ключ у зав. хозяйством;37.654017 47.832723;
пгт. Оленовка;ОСМД  «Ника»;пгт. Оленовка, ул.Деповская, 8;Мартынова Л.И. 071 313 81 07;120;ключ у зав. хозяйством;38.271761 48.261232;
пгт. Оленовка;Оленовский городской дом культуры;пгт. Еленовка, ул. Ленина, 6;Сыромяткикова Ю.А. 071-313-27-90;25;ключ у зав. хозяйством;37.655652 47.83657;
пгт. Оленовка;ОСМД «Континент»;пгт. Оленовка, мкр. Новый, 4;Белик Н.П. 071 310 66 80;210;ключ у зав. хозяйством;37.653433 47.833098;
пгт. Оленовка;Оленовская поселковая администрация;пгт. Еленовка, ул. Ленина, 6;Богданов П.Н. 071 313 57 69;10;ключ у зав. хозяйством;37.655652 47.83657;
пгт. Оленовка;ОСМД «Люкс»;пгт. Оленовка, мкр. Новый, 5;Белик Н.П. 071 310 66 80;15;ключ у зав. хозяйством;37.653388 47.832638;
пгт. Оленовка;Министерство транспорта ДНР, подземный переход между автобусными станциями;пгт. Оленовка,ул. Ленина;нет сведений;80;свободный доступ;37.652427 47.834072;